Segment,polarity,,
I'm taking a look here again. And you know what in my previous response I actually said that I wish that this page had an ability to have a secure chat function with someone and I do see at the bottom of the page that a little chat box actually just popped up.,negative,2760695_82,2
And it doesn't open it in the correct size of the view. OK.,negative,2767241_80,2
So yeah that's interesting there through it's got it. Good link your plan to card number this I dislike that I don't know why this is here.,negative,2763062_225,2
I like this idea but it just seems like it's. Yeah this is going to court to put maybe the highest or most popular articles under each section and there is a Bugs land is it easy to locate something of interest to me.,negative,2779597_50,2
And also if you see a Contact Us page here. Now that I'm looking down at the bottom of the page and I correct myself there is a page called The manifesto which I'm assuming.,negative,2770907_39,2
I don't see a close up of the instrument panel up here. And since I was here.,negative,2767525_24,2
So basically what I'm learning here is there are different options for how to crack the posting there is one talks about doing kind of practical hosting with mobile devices which I'm not seeing immediately from this particular Web site that I'm looking at Kyra hosting not talking about mobile devices at all in any of the.,negative,2770816_16,2
I'm not sure I know the right word doesn't. I would say tacky but it just has a very unique look to it and that might be we're catering to I'm not sure but it just it just stuck out to me and it just made my day a personal preference.,negative,2770907_69,2
One two three four five seven seconds here. So something doesn't correspond properly here.,negative,2763702_57,2
You know it's just kind of abroad and I'm sure the more that I watch the more who is able to come up with what I would like.,negative,2763062_113,2
Perhaps it was at the pre. When it was on the previous page.,negative,2760695_95,2
Yes to where we saw a price. I wish that there was a category because I.,negative,2764942_14,2
Lots of text trying to get a kind of an idea what it is so best edge just like kind of an adventurous art website.,negative,2779597_43,2
Some of the a lot of them are very inaccurate they're just provide the timetable those.,negative,2769335_41,2
I think the layout is helping them bad it's just there are some things I could be quite low quintuplets it's just a little confusing but I will give this one to three brothers it was so fun about course that's interesting.,negative,2779597_45,2
Yeah. So I want to go trying to use my paypal account my son and everything else that I could do it so since it took so long to get to that point I was just done and I'll just use my credit card.,negative,2764942_70,2
Definitely not easy to find but I do take back my previous statement about not having enough information regarding the company.,negative,2770907_41,2
There doesn't appear to be any word about page or anything regarding the company.,negative,2770907_22,2
This formatting right here might even cause trouble in your database not really sure what color.,negative,2767241_44,2
So where and when you validate the address this is a plus to get points on that one.,negative,2767241_103,2
Obviously the categories don't seem that broad for you clearly. What do I find not to be used for.,negative,2763062_92,2
So I think at this point it might be a little bit too early to us that information service reason I'm going to click on too much.,negative,2760695_60,2
It's looks like I was getting stuck at every single point. I know you're God creating and there's a lot of guy patients one time reading history but you guys need to check up on that other than that there's absolutely no problems the fact that you can actually create a bull fight just by going to getting the fees book into that was sure to do only only good.,negative,2769335_51,2
One two three four five six seven. OK maybe it's because the purpose of this test is not quite right but the pie pieces should all be better.,negative,2763702_59,2
Things i know i'm a certain light but I think that you can improve on or definitely the.,negative,2770907_65,2
And as I said we create to sign the consent and then I get a quote in a spring you need to sign up that I would expect but all the hair interest sign up it would be good if you know it could be signed up or maybe I've been here before say they have an account signing last name and I can put in them.,negative,2772615_43,2
They could go about validating it like with a little checkbox as you. Each one of those.,negative,2767241_53,2
To kind of useful. When everything is useful like the Updates section that is not useful.,negative,2763062_215,2
You know what something that shocked me was the classification like there's a section of late night shows and there's this section of rich and fabulous or I would just housewives action but I'm sure there's something like the car dash scenes in here somewhere.,negative,2763062_125,2
So I can then decide what's in my price range and what isn't not might they're very easy to beat on this because in the wild.,negative,2767525_10,2
You know I'm find out through. I have a Macy's account and I have plenty account like I was one of those would have given me free shipping by being one of those members because otherwise kind of like well what's the point of signing up for me says that.,negative,2764942_62,2
I mean even with the how to navigate section over here. I can't exactly say.,negative,2767241_100,2
What a checkout of products. The products kind of trade in their lives and say you have out of the other suspects machines can pay to line up in looking at and see whether they offer better features and perhaps they wanted already been looking at but like I said there's no comparison.,negative,2767525_46,2
The feel of this this trade here. This. Is it feels real cold for some reason or another.,negative,2767241_7,2
So yeah I guess the whole transformational be in the next best next version of the final votes good website will be a system that can be finished that would be good to contact us at the top.,negative,2772615_49,2
This is kind of interesting here. I was kind of maybe if. So this is basically a little bit about them.,negative,2779597_21,2
What would it change but here I would probably I don't know if all these GIF images are really needed it would be nice but maybe it's actually something that would be alongside here that goes along with reading it kind of breaks it up a little too much for me or maybe they're a little too large.,negative,2779597_16,2
What do you like least about this site. Do it like. I said this is a direct comparison to based on M.P.G. I can change the parameters and realize that before.,negative,2763702_44,2
You know kind of old lady ish. Or just really weird styles. Q.,negative,2764942_28,2
Brought to the twenty fifth. Why is that I wonder. Of a lot of information about the two point four in line.,negative,2763702_10,2
This plan here. One hundred bucks. OK I mean once you catch on to the system it's pretty easy to use just the Select button it should be a checkbox because I know that was interactive first and that didn't stand out whatsoever.,negative,2767241_82,2
So mailing address. That seems like something I would not want to yesterday now because I really don't.,negative,2767241_41,2
So this is just gets me to special pricing not really a live demo OK so get live event special pricing for the request.,negative,2770816_38,2
It seems like that or they're getting funded by this or are advertised men money from this but yet the less maybe a touch too simple at the top.,negative,2779597_64,2
What else you know honestly would be kind of. Fun to get a list of like recommended shows like right from the start maybe have a section that's optional where you can pick things that you're interested in or show that you're already watching and then for who to recommend notes I know that there is recommend section but I'm saying like right from the get go because I believe you have to actually watch some stuff before things are recommended because it doesn't make any sense to recommend something.,negative,2763062_75,2
This is wrong. You know I'm going to go back to the MIT.,negative,2763062_154,2
Because this will confuse older users and also. Anyway it's not a bad idea to put it on there but it also sounds like it always.,negative,2767241_59,2
I think that this website should make it so make this place to enter information of a little more clear.,negative,2760695_28,2
So I strongly agree. I would not come back to this web so soon.,negative,2767241_99,2
I have to give you my information. I what I would have liked instead would to been able to sign up for Hulu and at the end of that week you guys just shut it down and stead of me have to go in and cancel everything and give you my information that can make a lot of people uncomfortable and feel intimidated to sign up.,negative,2763062_35,2
I imagine that the person changes depending on what is in the background maybe there's like some sort of scary thing back you're like oh OK that's going to negative but for now.,negative,2763062_80,2
I like the vertical miss on the front page but I'm not so sure I liked it on the the middle page when I was getting to the women stops.,negative,2760801_95,2
I don't mind how frequent they aren't just think they might be a little larger or a student maybe on the right side of this frame and then you can keep the text flowing on the left.,negative,2779597_17,2
It's nice. I don't understand how you guys are doing with your time tracking I don't think they're not able to get the approximately you know minutes.,negative,2769335_12,2
Is there any information on this page that you think is missing. Yeah I kind of already covered that a little bit.,negative,2767263_12,2
It tipped the sleep too quick on the buttons here Spanish wrote Shylock that.,negative,2760801_85,2
So I don't understand what happened there so I just created one and I wanted to use my email but it wouldn't let me use that as my username.,negative,2778867_29,2
They're not a bad idea. But it might also be nice to put a little bit of text on them like comment on a question.,negative,2767263_53,2
Hopefully going to. OK I guess I didn't work out the way I wanted it to go I had hit the join with Google and its It said that if I allow or not and I allowed it but just went to Google and choose a search and ship so I'll just create a new one here.,negative,2778867_22,2
It's gotta be based on that. But yeah you know Mob Wives. So I find that interesting that's not exactly what I would expect to see I would expect to see like.,negative,2763062_126,2
There were so many of them. There were well over one hundred pictures there that I could have clicked on it doesn't it's not that I don't like the pictures I thought a lot of them were very good it's just because the size of the thumbnail perhaps let me just the pictures.,negative,2763702_19,2
Well I can complete it. That's annoying but I guess I have to enter.,negative,2764942_56,2
However it does seem like there is a tad bit too much blue in this first web site here.,negative,2770907_5,2
Mobile company doesn't look reliable trust them at the moment I see that they have page T T P S over here which means that it's your website if I hover over this sort of connections private which is fine.,negative,2772615_20,2
It does a loop twice so which isn't. Ideal. But it's not super annoying.,negative,2767241_48,2
Information I can quickly skeered through one more time just to see if I missed it so it does show mobile devices being used to play the Web site words or anything to confirm that there are definitely seem to be different Web sites that are offering current practice design website designs for kind of practical website is where they've learned what I've learned quite a bit and just clicking on a few of the search is going to close this for now do you have done something wrong.,negative,2770816_17,2
OK So also the title of that pop up is kind of hominess and first security safety.,negative,2767241_49,2
You should be using it. Are there any. Rules of Conduct on the site any topics that you should or shouldn't be posting on.,negative,2767263_51,2
You know change or move. This. I'd be kind of weird. But I would kind of get rid of the Latino section B. thing imagine that that's a section where they only speak Spanish I mean it could be completely wrong and crazy so it's I know just crazy I maybe not crazy at all.,negative,2763062_132,2
But just just looking at it this is something that I would remove just because it's a political thing.,negative,2763062_139,2
Not entirely sure what I was going to show you. Said a quick look at that.,negative,2767525_25,2
Twenty years old so I wish that there was a category for my father not to do in years it's a little too and short or flashy or things like that but Mrs are always kind of like old lady S..,negative,2764942_15,2
OK that's a little high. You know it's not a dress. OK and you dress for a wedding night.,negative,2764942_21,2
And also this front image right here this gift of blue that includes being touched up it just kind of sticks out and.,negative,2770907_68,2
This looks like just that trailer for it so. Yes that's no that's that you know.,negative,2763062_182,2
So it is the beginning of it which is fine. I guess that that counts as an issue than that was pretty much the only issue.,negative,2778867_30,2
OK I do see it at the bottom now. So I will go ahead and enter the code it did take me a couple seconds to find this.,negative,2760695_25,2
Yeah all Spanish. So it's a whole section devoted to Spanish speaking and I that is something that I would move because I took Spanish in high school I don't remember anything.,negative,2763062_133,2
To fix it obviously. Yeah I would like to send a fast forward and rewind button and maybe the section that shows where the advertisements are going to be because I think that for his limited commercials.,negative,2763062_189,2
I would think it was trying to sell medical equipment possibly pacemakers or something like that because it's a very bland.,negative,2767241_95,2
Now is it that was that was my. Personal. Confusion not not who it was and as far as logging and logging it seems very simple.,negative,2763062_49,2
That I didn't click on Pay Pal. Well that's only going click on it I wanted plenty.,negative,2764942_52,2
Said to come this very paranoid has come a cry and there's not much information on that today only She's expected to give you technical specs down here and there's a full spec as well this is thing I was looking for so I guess this page inclines it was some sort of thing that he's going off to separate from that and what I want to do is do you know to do a comparison and us move on.,negative,2767525_15,2
OK so the only thing you guys need to look at is probably your.,negative,2769335_48,2
OK. That's it. It takes a little dying to go OK and that he had a dating No no I don't want to go to commercial.,negative,2769335_6,2
Casper down here. Yeah it's a little confusing if we're promoting the Casper product or if it's an individual blog about Casper.,negative,2779597_56,2
So I would ideally like if I pick care and I get more information.,negative,2772615_13,2
I have never heard of it so maybe pull them and. With starting with popular movies pull people in with this and then.,negative,2763062_142,2
Version of things with the line on the side. I think I like OK took me a bit here let's find tops alphabetical so I was going down but I I sort of wonder if I like the buttons.,negative,2760801_79,2
The section over here almost looks like a check out the screen for. Alternate shipping address.,negative,2767241_8,2
There's a. It's a little bit busy so. Specials. Busy. And a third word for the US A little bit white it's it's sort of a blank color wise that it's you can scan through.,negative,2760801_21,2
I like seeing them all points each idea clearly separated from every other idea doesn't do that though this is like a review of the vehicle and what do you like what do you least like about this site that had to scroll through all those thumbnails to get down to the article.,negative,2763702_18,2
I actually think it asked for a little too much especially when it comes to the names of the C.N.M..,negative,2760695_58,2
They are focusing on maybe a mission statement or something along those lines instead of just a marketplace that kind of.,negative,2770907_37,2
Shipping with ranges it was more than the price of any of the shirts that I had bought and just because I didn't spend twenty five dollars Therefore I didn't get free shipping.,negative,2764942_61,2
As far as see. Oh I don't believe there was a search bar so what I mean by that is I'm pretty sure before you send if you can actually search through the movies on Hulu and the T.V. shows so you can look flip there and see like hey I really like this show.,negative,2763062_60,2
This is a prototype and. So the functionality of the page is a little bit limited.,negative,2767263_23,2
It seems like they're all pretty short that I go into women's and they're all like only my she was an in-between.,negative,2764942_39,2
I would make that a little bit more visible because unless you could come to a live or which doesn't seem like a help to help page of any sort.,negative,2770907_34,2
I mean give us more details on it just because when you're signing up through someone like I did and the last month we chased the.,negative,2767241_25,2
I think. This is my general to know that. And it focuses all your attention to the left of the screen which definitely doesn't utilize any of the real estate over here.,negative,2767241_10,2
One thing I noticed toward the bottom of this Web site is the links on the bottom of the web page regarding probably sort of kind of like a web site that are very faint they're out there a light gray on a white background which makes them hard to see and that might be changed to something a little bit more visible.,negative,2770907_23,2
I was expecting to be here. So it's great that it's in the middle of the page that makes it a lot easier.,negative,2763062_13,2
So if I can amend the previous response I do see that there is the ability here but I would make it a little more noticeable for the end user.,negative,2760695_83,2
I'm going to navigate to the general Shelby's help desk which first of all it does not appear that there was any yes there was there was a need help button on the top right corner.,negative,2770907_33,2
Descriptions. I again with the price that it will cost to add the premium out on I would add that right here just as the initial view.,negative,2763062_249,2
They're just a new technology a mattress that's coming out. It says or there that was a little confusing because it says hello talk up here.,negative,2779597_55,2
You know in a perfect world a consumer would like to see other things like these here.,negative,2763062_202,2
Seems like there's a little bit of wasted space in this and then this looks good on the bottom.,negative,2779597_24,2
Yeah I don't see anything off the bat about who is running it what organization or company is responsible for the web page.,negative,2767263_5,2
So this is something that I would get rid of I get trying to draw people into the real O'Neil's and it's a great T.V. show.,negative,2763062_138,2
I think you can clear up a little bit of your navigation and provide a little more information about site.,negative,2767263_55,2
In some show you like or for why shape or form sorry without you know individually going to each individual on and listing the things stand manually softened in comparison.,negative,2767525_50,2
Well archived information here. This also is kind of interesting. Maybe so they can go three by three instead of two or three here.,negative,2779597_23,2
Do you think that if I were to come back to Hulu and log in and look for the logon by and that actually might be a little bit harder to find i know i know kind of weird because that's that's where I was looking in that in the first place to sign up.,negative,2763062_51,2
I think that's great this kind of makes no sense this is just like a little less.,negative,2763062_105,2
Check up. Oh you know why is it twenty seven dollars mine dollars for shipping she has another Sure.,negative,2764942_49,2
Cher. Nice to have not necessary like that not this Kerry clip. That's nice to have a lot of the clips are like interviews.,negative,2763062_181,2
No one really cares. So this should be it be at the bottom.,negative,2763062_244,2
Please explain. Yeah I kind of touched on this a little bit earlier I would like to just from a consumer standpoint I would actually like to see who allow more time in the future I like a month like no like like they're competing counterparts not not a week.,negative,2763062_54,2
I mean over here or this is in more detail that we're looking at good going back to the main page.,negative,2772615_17,2
Business statement and I think I don't I'm not sure I have the right to say you know lower your prices but it could be helpful for people who are in the same situation as he but that all depends on who you're marketing yourself to and and their their current stature.,negative,2770907_79,2
It's kind of a duplications a previous question begs to feel like I knew this company well enough in the design of the website to not provide enough strength to really build your brick you cation and trustworthiness in my consumer opinion the website has a clean and simple presentation and I'm going to disagree with that there was a lot of different colors a lot of different fonts a lot of different sizes and a lot of scrolling that made it home kind of closures and hard to read actually provided any additional comments questions or suggestions at this point I just want to say thank you for the testing opportunity.,negative,2735639_66,2
And it makes sense you know the design that i choose. Has the letters go i particularly like this.,negative,2692837_18,2
I would have come down one of the smaller ones here. But actually contact is what i wanted to contact us so decks kind of threw me a little bit.,negative,2691417_68,2
I hope. I'm in the right place and I think I'm in the right place and.,negative,2757472_43,2
And shape of your future apply now so this is what i expected to see all that quite sure.,negative,2691417_38,2
All right so this is I think this whole free shipping thing is a little it's a little large I'm wondering if it's something that can always be more on the top because I feel like it splits the sour and I feel like it's almost the bottom of the page and it's a little confusing.,negative,2759108_93,2
Except to see. And here it is apply now for fire guy so yeah.,negative,2691417_40,2
So there's a different builders. Unit development as well as a house behind a house or the maybe they specialize in different stuff.,negative,2734347_12,2
Send and looking into their camp. For old web sites easy to use as a teen some presentation ok.,negative,2695844_65,2
This is a similar picture to what you have before i would actually stay with a different picture.,negative,2691417_127,2
No inches there oh I get it. OK joint spacing is sixteen inches.,negative,2706963_32,2
I know. There's no answer. OK So these are links. To builders.,negative,2734347_11,2
The only problem I had was keyboard issues with my key the keyboard on the i Pad so large and you forget the minimize and you can't get back but.,negative,2759108_139,2
So i did. I didn't want really need it because i thought i do all this myself.,negative,2696410_56,2
I think it's a weird but if it's an either or. I would expect.,negative,2701822_76,2
I mean maybe the only thing i say when i first open it up maybe have a little.,negative,2693070_16,2
The actual website. Hello to you specifically why it is good to have an account with.,negative,2746487_97,2
Everything was readable no issues with reading anything. I'm going to bring actually been the center before it's wasn't like the best I've seen I think as far as like font layout and font size and it could be adjusted slightly and it just seemed more like a hodgepodge type thing where you trying to throw everything into one section.,negative,2759108_131,2
The second one here. Which is the five guys story. Isn't bad but i'm surprised you don't.,negative,2691417_92,2
The first word which is bore. Bold it. And maybe that's just me that could just be me.,negative,2691417_86,2
And i think they could be just as a hair bit smaller because if i'm not interested in that information.,negative,2691417_183,2
Each pinpointed Google search that placed me on the page that provided see item I was looking for at the lower price.,negative,2735639_62,2
That patiently i've had. Team members you know. Like everyone does. That don't you know pull their weight or you know say they're going to do something and then once and then it stresses.,negative,2690771_174,2
You can use. To save every day i can't. For you. Now i can't begin the process to buy so new cutting edge ability to fail and.,negative,2695844_46,2
I'm interested in. Downloading the app and ordering the crew is secondary. And so i would shrink that a little bit.,negative,2691417_187,2
Yeah. Yeah that's a dig around. But the web site in general has every in.,negative,2692603_93,2
What if anything. Would you do to improve. This website. From page one inspiring.,negative,2695844_61,2
At the beginning. I didn't really look for. There were many tools or resources.,negative,2692603_13,2
However for others it might be going in to the future like i said.,negative,2692603_110,2
