Segment,polarity,,
I guess the easiest part about it was that i didn't i don't have to enter all the information from the card.,positive,2701940_52,5
So. And again by zip is fantastic. Usually all know my city remains up far more than one county.,positive,2699244_87,5
So it's nice that you can customize ease because these looks like these appear to be all the options that were maybe in like the professional package.,positive,2699911_51,5
You could stuff between. Fresh baked buns. I mean that kind of says it all to me right there.,positive,2691417_147,5
Let's go and let's kind of browse and see what kind of shirts they have you know these are really nice the layout here is clean very enticing.,positive,2759108_40,5
I think it's simple enough in the fact that t.v.. Easy to navigate.,positive,2693070_74,5
Kind of impressed. Will likely be an actual customer. If needed. So I am going to stop the recording.,positive,2743207_65,5
Other than that this is a really nice looking document. I'm going to click next go to and describe any previous pages that were confusing article longer for you to understand.,positive,2743207_53,5
So i really liked how this is set up i would give it a ten.,positive,2692837_41,5
All the big brands i've gotta find toys. Box to look out which is brilliant.,positive,2689063_3,5
I think it shows a different angle. With the clothing i want. Which is quite nice.,positive,2692416_86,5
In those areas and i can check on information for them. So it's nice i really do like the list feature for that.,positive,2699244_82,5
So the great thing about this site is that you can click on lessons and sort of look ahead and get an idea of the kind of things you'll be doing.,positive,2741838_19,5
Efficient. And you know overall it was a time saver for me. What was easy about the task of adding your prescription card easy.,positive,2701940_50,5
And if I thought so yeah. Not really actually I like the application are within a given a shot at in my personal time alone else you know something great job and I you know give you a good look on your business have a great good bye bye.,positive,2733662_54,5
In the patrice home. Phone and that's awesome. So it offers working technology so yeah this is everything that i was looking for.,positive,2689520_80,5
It's very professional. By the looks of it it's. When I first came to the website.,positive,2734347_61,5
Since I think this is really helping me out with their size and usually a large someone.,positive,2759108_79,5
I didn't need to crop. Everything. Everything was it was really smooth quick.,positive,2701940_49,5
If i click on this. Ok it actually brings up an email form which i like a lot of web sites.,positive,2699193_33,5
That's very gratifying and I like that. Let's try clicking black here. And yeah that's super clean.,positive,2759108_166,5
Go shorts. So again as i'm going through the site's beautiful site. All of the images.,positive,2689520_35,5
This wasn't a test would you send money yes yes I mean I love to try out new things and going all the Western Union at Wal-Mart is just kind of a headache.,positive,2733662_47,5
Easy use mobile web. Mean. Cool cool designs founders talking with business insider looks like.,positive,2696575_78,5
They're easy to find. Regarding this task specifically I think it's really great that they have all of the lessons laid out in bullet points just so organized.,positive,2741838_17,5
Sets. And i think that was difficult at all i wouldn't change anything i i think it's nice and simple.,positive,2693070_35,5
But it's a company i trust and if i had the money i. This would be a serious contender.,positive,2696410_74,5
I know I did a half fact will say I like how when I first asked me comes up with useful information gives me a sense of what I can do right near to me that this is a photo and then after the fact that I like a nice visual example not just written information someone has one that I see the next page tells me how to use the ninety freefall to program the.,positive,2737311_3,5
Which ever of those was good to see. Yeah it's great if you don't go to google and find one of the company officinalis of this competitive web site.,positive,2692416_76,5
Very cool. All right says i'm looking at this we've got our size.,positive,2689520_72,5
Yeah I think it's very informative it's very clean and. It's very appealing to the eye.,positive,2759108_162,5
Pops up right away. In list mode. I really like list modes right here told me.,positive,2699244_40,5
And pretty easy to get started it looks like. I will continue to go on next.,positive,2689843_12,5
I think that would just probably know it than one less thing. They want to follow.,positive,2693070_41,5
To me it's. Trustworthy. Stuff. That is legitimate and. You know.,positive,2643900_107,5
So yeah I I mean all of that information is right there so I can't think of anything else I'd want on this page.,positive,2731306_28,5
OK that's good that I can combat a project here but mean deciding which one is that to for me.,positive,2708487_42,5
Thank you thank you thank those both to see it be nice if i had the calculations or they don't want to bring up the calculator but you have it right there.,positive,2696410_12,5
There's a community response down below so that's great. There's some product that tribute this is great so much more detail about the product so what's special about it is we've got a stash pot it.,positive,2689520_83,5
Overall with the page. And it's very simple to use and i think a lot of people.,positive,2699244_111,5
A large picture. So it's a little more of a vertical page. Which I kinda like actually I think I like the vertical page and then I am an issue for women women.,positive,2760801_77,4
OK well now I know where to go to make a comment. So overall I think you have a website that's very promising it looks nice appealing kind of makes me want to jump in and start answering questions.,positive,2767263_54,4
Dominator Domini or the local markets leverage all the features in velocity media. So there is a all inclusive call dominator was included in the package is everything that I've read above such as the velocity media social and starter including social media video pay for collecting advertising which to the Pfizer impact with the Advanced Search Engine Optimisation domineering clue.,positive,2770816_58,4
Let's see. Here So that's the quote it was the fourth fourth creating practic websites for those type of services and then what strikes you about it is again writing colorful well laid out and not cluttered.,positive,2770816_33,4
So inviting would oddly enough is a third. Because you're open to these options without any tricky menus.,positive,2767241_17,4
Super long because it was actually processing that data and checking out my add Social Security number that that's good.,positive,2767241_64,4
Scuse me. I think it was extremely easy it was guided step by step by step very self explanatory It even had I did ample listed there which made it even easier for me I didn't see on the category that I wanted to include in this I would have liked to have military on there but other than I mean everything was.,positive,2778867_79,4
So you know this is great. Let's get one of five How easy or hard was it to find something to watch.,positive,2763062_111,4
If I'm just reading this where during you'd expect. Yeah I would definitely expect it to be to be appear somewhere you know I keep being drawn to the right.,positive,2763062_14,4
Like I said the second time I went through and it accounts it made sense because I knew the user interface at that point.,positive,2767241_88,4
Good thing that you guys have recognized that imagine that you need to go to friends' homes or to school to school because you're mine OK to find how to get there using Ok so I just point.,positive,2769335_24,4
So I really appreciate that I like that it gave the two options at the very beginning to choose whether or not you would like to do the commercial free or commercials limited marshals.,positive,2763062_26,4
It's really easy to look at it so it was easy to find something that interests me give that a four.,positive,2779597_62,4
Besides having them save my information. What emotions and experience on finding items and then placing an order.,positive,2764942_63,4
There was nothing difficult a confusing and there is nothing that I'd like to change from this app.,positive,2769335_38,4
Here's what has recently aired Are you interested in any of this simply want to hear if all else fails the search for a kind of thieves steal because people typically go into watching stuff with knowing what they want to watch if they can just find it as far as just browsing and looking for something you know there's a huge selection so it's it's great for anything missing that you would like or expect to see during your quest for a T.V. show or movie.,positive,2763062_120,4
What do you like or dislike. OK let's see here. I have to click on this in the interest.,positive,2779597_26,4
Yeah so very very positive. One. What do you like or find to be useful about the Senate experience please explain why and in point to specific examples to what do you dislike or find not be useful about this planet X. rays please explain why and point to specific examples and I believe I kind of covered this with the last question.,positive,2763062_28,4
So I'm going to tape in and A I think it did a pretty good job.,positive,2760695_49,4
They seem to be logically organized and I was able to easily find what I was looking for and I would say I had very probably look for what I was thinking of buying and then possibly go to the store.,positive,2760801_68,4
Safe. OK good you know. Maybe you experience when it comes to some of those.,positive,2767241_35,4
Mine is about to expire apparently. That's good to know. Yet this is this is good.,positive,2763062_222,4
It shows me the same thing pretty much and I mean there's a lot of stuff on the page one page.,positive,2772615_19,4
Yeah the lab is very clean. I don't really have any questions on what I'm looking at.,positive,2779597_3,4
The discount that I would receive for doing both I think that's a that's a nice deal here.,positive,2760695_6,4
If you want to here you go if you don't know pressure. What I dislike.,positive,2763062_33,4
Looks like it's a it's quite modern. In the ten. So when you know.,positive,2769335_3,4
I'm a big fan of those. Because they're related so if I like Hunger Games it's like I wonder what else is out there it's kind of all of these are all out there.,positive,2763062_184,4
Sign up process would go once that happens that look like logging in would be super simple I like that you highlighted that in orange because it makes it really easy to find one of my pet sites but I'm already a member of it is that sometimes the sign up for a new account button is really obvious but the log in if you already have an account button is kind of like up at the top or it might not even be a button it might just be a tiny little text like up here.,positive,2767263_45,4
So this one it seems but it actually gets done there's absolutely no issues you know.,positive,2769335_44,4
Tops and I can't remember what the other two things were but I like those bigger buttons to click on I think that's that's kind of where I'm at so.,positive,2760801_93,4
I can't think of anything else. There's a lot of you know once this.,positive,2763702_49,4
And are they out yet again like the home page this is very yes it's very clean and right to the point pros cons.,positive,2779597_60,4
Yeah it is very much like you go to the WHO site and it's like I am.,positive,2763062_42,4
Here on. Matters is very nice and it's being able to get into more popular posts.,positive,2779597_7,4
Yet it seems like the layouts really nice and things are quoted here I like the font style.,positive,2779597_10,4
But you guys had actually put it up. I know you guys are recommended so that's pretty cool.,positive,2769335_17,4
I think is easier just because of all the different choices and the filters that I can use and how easily accessible those were how would you improve finding an ordering items on the tablet so ordering items make paper work and have maybe a little bit more incentive for the ones that are signed up for plenty or signed up for and who finance ordering items I really think the shipping.,positive,2764942_72,4
This is this is great this is at the positivity it's kind of fun that it's kind of like writing and really like Oh look at all these things that are going on in network.,positive,2763062_85,4
What do I like about the layout. All right let's go to Bob Marley and Bob Marley's family Rian Yeah this is very clean I like I like the way the banners kind of relate here in the text box pops over it.,positive,2779597_46,4
Looks like they have a lot of American or United States themed clothing. Looks pretty pretty stylish.,positive,2770907_3,4
Now. And. Let's see I will follow the instructions as presented. And just about done entering the email address here and just click the Continue button and looks like I was successful here with entering the information.,positive,2760695_38,4
Yes I think so I can trust the information provided by Zacks the author of stories.,positive,2763702_14,4
You can incorporate that see going through your ideas Unser layouts every seven G. website provides a response layout to fluidity transition from the desktop to mobile and that definitely going to be helpful and then and often involve viewing experience for using reading an avocation another so compelling upgrade over five G. Forge and sixty websites.,positive,2770816_7,4
I like the use of imagery throughout to kind of break up the text.,positive,2779597_11,4
That. You must also like this is a must that. I love the You may also like sections.,positive,2763062_183,4
I mean that's how great is that you don't ask for too much you just ask for the right amount of information and you're showing me the right amount of information.,positive,2763062_205,4
I was simply asked for my name in my email and my my card number.,positive,2763062_30,4
Easy to go through so great the ability to narrow choices to find the products you're looking for I thought the choices were easy to make and as for narrowing.,positive,2760801_60,4
Yes it seems like right away that it's targeted for young couples or newlyweds and projects and houses and I kind of have a feel like it's a D.I.Y. type of site for couples that are trying to do a little money but have a really crafty and modern looking home which is nice it's very simple and clean.,positive,2779597_20,4
It's a good area more popular. So it's versus OK that makes sense.,positive,2763062_147,4
And learn more. On the basic home page here. I think it gives the user enough information to make an informed decision an issue or lingo further if that person chooses to do so what concerns or questions you have while we're reviewing step one.,positive,2760695_10,4
Get answers. Maybe get some stuff roll in around. All right I'm going to help go next to complete the stub snus necessary to create a new account stop after your account has been created know you can create your account using a made up email address please.,positive,2778867_19,4
I would use it like literally every day they know what I mean I mean indeed even a Titan from the sun from home to my college and back so that I do yes I know that your time you know as to when the bus is coming because of a naughty child or your quite idiotic and descent.,positive,2769335_20,4
Norton. The billing information. No real surprises here. This is exactly what I would expect to see.,positive,2760695_71,4
That actually focused. And that's because. As far as functionality goes this is a very well put together Web site.,positive,2767241_15,4
I would say for it was easy. I wouldn't say very easy because if we go back here.,positive,2763062_112,4
I think it's just enough here. Aside from the O.B. name that I've already talked about in previous questions.,positive,2760695_73,4
That's where I was trying to go but you made the log in button tiny and hard to find so good job making the log anything I find I like this category far here.,positive,2767263_47,4
And what information you're going to have to put in here. So it seems like they have quite a few options.,positive,2767241_24,4
Let's see here taking a look here at the page again. And nothing is really jumping off the page at me that I think should be removed from the page I think all the information there.,positive,2760695_20,4
So these are different designs and in some standard stuff down here. Finally they get appointment at the office hours testimonial and really looks good.,positive,2770816_41,4
The list of the networks. I think you see here. Anyways I like the list of the networks.,positive,2763062_84,4
Yeah it's really understand I was for on this. But let's find a blog post those interesting view the blog purpose.,positive,2779597_4,4
And. There's probably an option for gift cards and shipping layout is pretty nice.,positive,2770907_57,4
Yeah it's actually works really nicely if you can change one thing about this website.,positive,2779597_15,4
Some of the fields and then the other ones were were ready for it so that was good.,positive,2767241_109,4
There's a lot more going on you can. You can see a lot more questions all on the same page without necessarily having to scroll so far because they're not big on you also see somewhere around the question what user posted it so there's less anonymity.,positive,2767263_35,4
You don't want to sit there all the credits before the Up next shows up and you have to go and you want to just do it now you just click this and bam gone to the next thing.,positive,2763062_178,4
You know I think it's again pretty self-explanatory It's very neat to in an easy to understand I really thought it was neat.,positive,2778867_89,4
This is everything that I need to know I mean you guys don't even need my address my home address.,positive,2763062_204,4
So that has also been shown that So that is you. Odio nice it does it's a good move from the identity of.,positive,2769335_47,4
I think it as an appropriate amount of information here and. Like I've already stated this is all information that I would expect to have to put on a site like this what concerns or questions do you have while reviewing Step four What if anything would make it better so let's see here going to go back and review the page one more time again.,positive,2760695_74,4
I like that I don't have to dig around the page to find that Campbell's subscription or put it on hold and like that's very readily available I know that if you're trying to do this on Netflix.,positive,2763062_210,4
I actually think it's just enough. If someone wanted to learn more about these options I would assume that I could click on one of the option.,positive,2760695_9,4
Because I can just easily scroll down the list to be like oh I want to see questions about food without having to go to a separate page to look at a list of categories and I do like the big question tiles here.,positive,2767263_48,4
So I do think now that I'm understanding this page more that there is mostly enough information on this page to at least.,positive,2760695_15,4
So I could move it actually not sure about it and I say this is one that sort of thing I'm not saying you like.,positive,2767525_27,4
I think it was a simple process so I choose five in your opinion is step to ask for too much too little just enough personal information as I stated.,positive,2760695_41,4
I think a lot of new fashion trends. Things that are popular these days so it's definitely up to date.,positive,2770907_4,4
Just scrolling through I'm just trying to think of if there is any think and fusing or unclear about finding something to watch you know I felt it was very clear not confusing.,positive,2763062_118,4
Like a science culture blog. Curiosity is asleep. So it's a blog basically specializing with sleeping patterns and anything affecting your sleep which is pretty cool or this is kind of like the islet story right now and then we get into more sports.,positive,2779597_2,4
How likely are you to revisit Macy's on your i Pad in the future I would say very likely because it was easy to move around and I thought all the separations of the you know different areas that you might be shopping.,positive,2760801_67,4
Oh OK This is a must have for people my first thing that I'm drawn to is the quality because I love this.,positive,2763062_170,4
Her would respond. In looks like I can just kind of put my two cents in scuse me and you know say what's on my mind and see were and how far I can get to solutions for my problem.,positive,2778867_13,4
What do I like least. I can't think of anything really that I like least I've got to find something that's not as good as everything else right.,positive,2763702_46,4
Let's see I mean it's all youthful I mean there's just there's so much.,positive,2763062_93,4
I can say what my stance is on the issue and see how many people agree or what their stances are.,positive,2778867_58,4
It is different good. So there actually are more testimonials. Axel I really like that did not disappoint go back to this on page that was basically a couple things that I really wanted to do.,positive,2770816_48,4
And they had bold print title. So there wasn't anything you wouldn't expect there's the polls there's you know the issue is the new.,positive,2778867_87,4
If you're up here. It would be too easy to quit. Connect with these again.,positive,2763062_198,4
Yes a very clean blog actually like I like this I like just being thrown big beautiful imagery and it's a really nice photos from say anything is really not a lot of text or and yeah I guess it's just yes Mark this one was strictly a photo shoot so yeah I think that's the really nice layout and I like how the most popular items here this is pretty cool and you can ship between the weekly and monthly.,positive,2779597_47,4
Yeah I would say that's a must is kind of nice to know like I should've done T.V. show to see like what that current episode that's coming up is going to be about you know all this stuff.,positive,2763062_180,4
I don't think anything was difficult or confusing really it was very well laid out self-explanatory.,positive,2778867_86,4
OK good all your things one forty six. Oh that's nice. That's you at the same time.,positive,2769335_10,4
Again it's very I like how clean the fonts are and that's it really really pushes the design farther.,positive,2779597_28,4
So I think that the controls are probably going to be pretty familiar to most people like I would expect clicking here to have a text box top open to be able to comment on this question because that's a symbol that's pretty familiar to me.,positive,2767263_19,4
I think they narrowed adequately with the choices I was given you know to for me to look through what I was looking specifically for so I would rate you.,positive,2760801_61,4
OK So you definitely have some good deals going on as well. Go ahead and I'm kind of interesting about this July better to when I hear them.,positive,2770907_9,4
Version. OK but I definitely like this version better than the first much much better at providing me the information that I would need to decide whether or not this is the car for me.,positive,2763702_69,4
OK so I will go ahead and enter fake information here. So far this is all information that I would expect to have to enter here.,positive,2760695_34,4
The night shows so. Well movie trailers interesting. OK. But yeah I like that it's categorized.,positive,2763062_91,4
I just would look at more of the issues and trying to weigh in and see I like how I can put.,positive,2778867_57,4
So for was looks quite professional looking website their go their products your business fee a profit and patience.,positive,2767525_4,4
Basically I've learned here that there are drive ways the seventh generation website system is basically the way to go provides a easy interface for moving to tablets or even small part from vises mobile devices which is excellent that way the customer can actually go through a smartphone or any mobile device to search the Web site Funny information about the chiropractic system that they want there's also a variety of different pictures one can use to start off and building their website.,positive,2770816_11,4
So in regards to what this company offers in competition with competitors. It does look like there are some some custom things that you probably wouldn't find other places.,positive,2770907_14,4
Here's your free trial this looks. I'm sorry this is awesome. I thought it was a seven day trial.,positive,2763062_229,4
And so it looks like it's a trusted Web site again the phone. Numberous hair.,positive,2772615_21,4
Very quiet and I need the subtitles auto play so must have must have.,positive,2763062_172,4
Go buy brands or whatever but I like the buttons that you have here so I'm going to look at she sets and charter club all we should get one five hundred K.M.'s H..,positive,2760801_44,4
But yeah it's really easy for me to look at something that was cool.,positive,2779597_34,4
Using the dropdown menu to run around and tobacco. It worked for me so I thought I thought it was good.,positive,2760801_65,4
And so this is great because I can just click here and it'll show me the shows that I'm already watching and they're Show me a bunch of other shows that I'm watching and since A.B.C. is one of the I mean gotos I think that's fantastic because and I think we'll see these pushing out and go watch that same thing you know it goes for all of these things.,positive,2763062_89,4
