Segment,polarity,,
Under Armor and. Yet again we have to click done all in the top or a that's kind of a little annoying.,negative,2759108_50,1
This is a little bit messy. It doesn't look like us much care it's been put into it I'm sure it has but just straight off the bat that's sort of the vibe in comparison to.,negative,2746487_88,1
Do i get the did ikey did i pee in this special stuff. With with these or is it only with.,negative,2696410_45,1
Or landing page to convey that strong record mediation and trust her to consumers and something about saving something about nature that says this company has got high quality items at great prices.,negative,2735639_13,1
Langhorne it was legal and this reset project would be very helpful to make the icons more clear with their functionality in this when I asked this poor else I could press the holes.,negative,2737311_39,1
Members other members of the team base they have to pick up the slack and things like that can reach frustrations.,negative,2690771_175,1
I've no idea. So the tutorial is now working. I see everything else is working on my phone.,negative,2756980_32,1
What I don't like about it. Is. Although I do like the simplicity I also in a sense doesn't like it because it just means that our particular outfit really stands out.,negative,2746487_18,1
So I'm guessing that the site is not complete. So some of that stuff will be worked out later.,negative,2743207_52,1
I want to search appear to see if you could do neighborhood. Search that way.,negative,2698247_45,1
It's not too complex. About your experiences with the site's search feature. I believe I used it once and I was trying to search out for work shirts It brought me into a section with a mix of everything women's and men's clothing and for me I think I preferred to use the go back to the men's shirts section and then filter from there because I knew I did do it and I didn't want to take the extra extra steps within that search feature.,negative,2759108_136,1
Page back. First it. Oh it didn't do it that way. Interesting interesting things.,negative,2691417_73,1
Because the very first picture i said i had to redo and that's because it took the picture so quickly.,negative,2701940_69,1
Yeah. That covers a lot that. Comments questions or suggestions. May be the only thing that annoyed me while looking at this website was that video if I if I'm going back between PETA standard homes and ultimate homes is that it's on auto play.,negative,2734347_76,1
But just the only thing is make sure that your app is responsive and I know this is a test app and that probably has a lot to do with it but people have no patience.,negative,2756980_66,1
OK so now that you've requested your sitter you're back on your home page go to the attending sitters and Reserves Sabrina OK Amy though I'm not sure how to do that to see request a sitter they click requests that are you know.,negative,2731306_37,1
It's an area. I'm surprised I'm not seeing any. So I'm going back up to the top and putting in night.,negative,2735639_34,1
And I'm not sure about the length of the dress either and she's quite a lot told me so it would be hard for me to want to purchase the dress of mine.,negative,2746487_73,1
I don't know as I don't know them in unavailable. So when a collector it brought up her profile.,negative,2731306_42,1
Easy to navigate through so yes I think next. How do you think it could be improved just everything else the spine the logo everything I like everything about this application but just one thing that it lacks is that the fact that the text messages there's a lot of a delay I mean I have four bars right now and I should receiving tough matches right away and I do check lot of people and I get it right away but over here issues the fact of the Texas is a really slow.,negative,2733662_52,1
I see has one. I just actually has a way to go templates I found this is a little bit confused and I and Shelly and I would be all templates but when I wanted section where we create a photo I To me it makes more sense only had I didn't see through your my suggestion maybe all templates at that time not with any features for a template.,negative,2737311_49,1
I mean I don't really think that it has a purpose. To be honest I think you should just be able to go about your business and if you run out of a coin.,negative,2741896_61,1
I typed in the initials here. And then it's on the charm. Ok there it is not sure.,negative,2692837_12,1
You know the Apply button needs to maybe follow you down the screen because sometimes I probably would forget to go up and hit it and I would have to go and redo that search.,negative,2759108_75,1
Just control F. and find the word I was looking for. Otherwise I probably would have missed that I haven't actually been a home buyer myself so I'm not fully aware of what frontage and stuff is obviously if it's going to be a big deal if it's up here on this main set of details here.,negative,2734347_44,1
Code is having troubles getting here to me. Oh I just got it I just got it so there was a little bit delay.,negative,2733662_16,1
So i do see contact details here. But it would be great if there was a little bit more information.,negative,2701822_23,1
Location four. To fill out an application for the five guys. Right and i'm not one hundred percent sure.,negative,2691417_35,1
And the domain registration. Now set. Free for life or do i have to pay for that later.,negative,2696410_67,1
Right off the top of my head the business solicitor. Doesn't make any sense to me.,negative,2701822_5,1
I did. Kind of not really have any idea what was going on.,negative,2734347_62,1
You don't know exactly if they're going to space to doubt the way it's supposed to be.,negative,2692837_36,1
The companies look pixilated on my phone so it looks like they're not this doesn't look as professional when you can see that pixelation I know most people or most companies that have logos will have them as a vector files or something so that you don't see that pixelation and maybe it's just so that you could make the site load faster but that pixelation is kind of distracting and it makes me feel like this is Los professional if you can see that it's totally a minor thing but also.,negative,2758249_74,1
I think finding an ordering I don't know maybe having a panel on the left right or left side that's kind of locked in that Ollie's it's easier to navigate bigger buttons for your fingers the head.,negative,2759108_152,1
I just don't know I don't know you but there's other sites like this again out at the repeal of the fine print and I'm actually works.,negative,2756980_51,1
I would actually have no idea just from that five seconds and I didn't catch anything.,negative,2734347_5,1
But see they say this is more of a game. So if it's a game to make the divert a different spin on it so I'm not really sure I understand how it operates but I don't know exactly what it.,negative,2756980_52,1
So again I would say maybe the music's not so great maybe the cartoonish aspect of it but maybe because of the games again I don't know what are you or your game is it legit shopping is a combination of both maybe explain that and some kind of to Toro a little pop up screen thing before you actually start.,negative,2756980_62,1
You're not stuck and not being able to look at anybody's answers to their questions.,negative,2741896_62,1
Contracted it all looks really good. The only thing that I'm still a little stumped on was I didn't enter city for any of this.,negative,2743207_49,1
Tech. Yeah. So like I said I missed it the first time I was scrolling through all of these pages I missed the link to the transcript.,negative,2741838_46,1
If you did want me to click their ah. So i'm not quite sure what happened before i doubt this is more what i expected careers.,negative,2691417_36,1
Just previously sort of talked about this but I would because if the price point I would probably buy install just because I'm not too sure about the sizing on the dress and a little bit confused about whether the size chart is for the dress or whether it's just for gold measurements for a standard size ten or so and its size twelve.,negative,2746487_69,1
It's very hard and so maybe you have to give away a lot of freebies at first to get people to build in but still for them and I why are you giving me freebies.,negative,2756980_59,1
Oh gosh. So much better. OK. So do you feel this sort of information that you need to validate or make a difference in your decision explain.,positive,2763702_34,5
I'm going to click five here entirely trustworthy. I could tell that this site is professionally done it looks very very professional.,positive,2760695_98,5
It's looks pretty clear to me. For those reasons I'm going to choose five continue to submit you to submit your fake order.,positive,2760695_88,5
Yes I think I would have had a really good experience on this particular site.,positive,2760695_105,5
I was definitely interested in seeing what the pricing available for the Damir was it gives me everything I need allows me to build everything but I would definitely be entering my name and it looks very easy a lot of personal information I need to give and that starts the ball early.,positive,2770816_66,5
This is a great opening picture very positive. I love the set up of these it's definitely different than the way who used to do things that used just the john and then a list and John run list and just you know like I love it they've got the pictures it's nice.,positive,2763062_5,5
Pretty straightforward gives the timings it gives you the bus numbers everything at her fingertips as well as the creators of the seem to have a lot of in-depth knowledge about the location of my sense of them and I said many of the bus stands that this app shows actually is not dead.,positive,2769335_45,5
This type of information or the information that was requested was exactly what I was expecting here for this type of site for this type of service.,positive,2760695_42,5
Yes I will probably sign up for this so that my details and find out I think it pretty simple but look for the sign up process.,positive,2772615_32,5
I like the more. Vertical. On the front page. But then I like the button options on the first site when I got into the women's side and it said.,positive,2760801_92,5
I like the networks list but it's here. I find this to be very useful because I know that I tend to watch a lot of things that are on A.B.C. like Grey's and other things.,positive,2763062_88,5
So I mean that it's just it's very simple it's very positive great pictures in the background always evolving in T.V. very staying on point with new.,positive,2763062_27,5
You know the buttons are excellent matches with the color schemes really like that so overall that's what strikes me about the page moving on put yourself in the shoes of a person who searched Google for back to quit to sign it up here.,positive,2770816_35,5
Yeah I kind of I would strongly agree with that it really broke it down so I kind of knew what section.,positive,2779597_13,5
I mean this is great because it's like a few don't really know what you want to watch here's recommendation.,positive,2763062_119,5
This is fantastic. This is a must have because. You know if someone walks it or may start talking to you you miss a few seconds away hold on and they just click it real quick and bam you're there you don't have to sort through and face watching an ad possibly because I know.,positive,2763062_175,5
And he said happy. No negative emotions. It was all positive when placing my order and definitely positive because when I looked up in my cart there were two things and I had put two things in it so that's that I would say an extra happy.,positive,2760801_56,5
I think I would trust this company. If you wouldn't start the loan process.,positive,2772615_29,5
So Paul way I. Unfortunately I don't think I can help you improve on that because I think you do a really good job with it.,positive,2760801_73,5
So to me is that OK let's say three words to describe it convenient because I like little to haves and say flashy because I see the one day sale and I want to go right there and look at all the things that are right there are actually convenient and accessible because I can click on the different leagues.,positive,2764942_9,5
Yes at this prepared press is the best way is very good very positive comments and definitely getting the most out of your return on investment definitely like that so a lot of very positive comments there drawing me in the colors and everything are drawing in the layout is excellent not cluttered very good.,positive,2770816_28,5
But I think the actual shopping experience was was good and easy to move around so next what emotions did you experience when finding items and placing your order happiness in finding what I was looking for I would say delighted to find California king.,positive,2760801_55,5
It's definitely a legit It looks like a legitimate Web site. It looks like something that was professionally done and they definitely have clean visuals.,positive,2770907_29,5
More exciting. I don't know why but it just felt a little more alive exciting and the third where I was it was colorful versus Stark.,positive,2760801_87,5
It's always nice to say informative and I think that's what this app is trying to trying to do with about you know too many weird stuff.,positive,2778867_92,5
So I am here now I do see that there is a lot of drop down menus here which I certainly appreciate this will save me a lot of time from having to enter the information here.,positive,2760695_52,5
I think they're extremely clear there's three choices. The prices are clearly listed and the options are pretty easy to understand so for those reasons I'm going to choose five in your opinion to step one show too much too little or just enough information.,positive,2760695_8,5
I really like the use of the dropdown menus here throughout some of the steps any time I don't have to actually type something on my i Pad or my phone I like it it's just saves time so I think there was there were nice strategic uses emplacements a dropdown menu here to help the end user save time.,positive,2760695_102,5
I have cable one which means that I have got a data plan. And so it's nice that I can choose low quality or high quality depending on how or H.D. depending on how much data I feel like using or where I'm at so this is fantastic for those kind of customers close caption these are very So the setting for is a must have because I have kids and a lot of the time I have my shows very.,positive,2763062_171,5
I like the check out basket. It was definitely differentiated cells from other competitors.,positive,2770907_62,5
I. I have to say nothing frustrating or confusing about the website so far I did really like your cut you're showing the colors and it made it very easy to shop easy and easy to back up and move around so next we're going to how was my overall shopping experience finding the items.,positive,2760801_53,5
It's not it's not a simple font that everyone else would be using and I like the layout of everything on the right here it feels like it's in the right place and easy to access access.,positive,2779597_29,5
I would give you good marks very good marks for that as I could use the drop down menu on the side it was easy to find someone who may not be as comfortable wouldn't know what those three lines were at the top left that that means you're going to find another menu over here.,positive,2760801_63,5
But it was generally an easy shopping experience that I would recommend either way an easy shopping experience to purchase clothes or bedding which I have done.,positive,2760801_101,5
If you've got a really great set up like you said the search bar here are just they're great.,positive,2763062_130,5
So this is cool and I think it was a story about her. Yeah I think it's a really clean blog page and.,positive,2779597_30,5
I got a free download excellent free is good are designed to get through a few more testimonial and live shot definitely like that like the ability to go view different things definitely like going using the opinions of other people have used this website needing to know that it's great when the things I didn't see on some of the other sites this right away and then have a live chat interface got contact got all the standard to privacy policies and so or and then the address of the company so and then have the Better Business Bureau label and a Google partner both excellent giving credibility to the company.,positive,2770816_25,5
But what I liked. Was that it was. Very easy very simple very clear cut it was I wasn't asked a million questions.,positive,2763062_29,5
Anyway. Sorry. Three Gratian in. Your very very simple very easy to use.,positive,2763062_21,5
Gives me a summary of what I've already done here. Entering the payment information is really easy in is very clear and not confusing to me so I'm going to go ahead and type in and they again here.,positive,2760695_76,5
Let's look at that more in depth. I like the way in a T. You get quite a nice group with the big group to look at and then easy to come back down to we are blue into blues in my house and I don't like to dark sheet and my bedroom it's blue.,positive,2760801_50,5
Now. And I do like the use of the dropdown menus here any time when I could save myself from having to type information certainly appreciated.,positive,2760695_36,5
I like the color. It's very bold and you know. I'm very very neat up and you know when it comes of definitely will give it a go again thank you.,positive,2778867_99,5
Or in my state for this issue. Looks like I can really you know make a difference and ask what I mean make a difference I mean make make my voice heard really.,positive,2778867_18,5
Ok listening then one calls dot com. I like this I don't it's very simple and it has a very style very trendy look to it including the tax that really like other taxes laid out from the start it's actually very nice and very clean skilled at all sizes the messages here are pretty simple yet.,positive,2779597_1,5
BLOCK OK call them or is there. Excellent right up front with that in their biggest free demo and special pricing Vince scrolling thing your business fear of resource free down the dance for getting services social services free webinars day and years of pictures and talking about your guy to building a positive online reputation statement.,positive,2770816_24,5
OK I can get another vehicle. OK this is meant to sleep better.,positive,2763702_33,5
So yes I would fill it out looks very easy to sell out and doesn't ask a lot of questions I would have to give personal information is in fact just straightforward start building relationships.,positive,2770816_67,5
Readability of the page is excellent I easy to find things easy to read about what I wanted you know what were the sheets made of what was a shirt made of they were.,positive,2760801_59,5
I feel like it's trustworthy and I think that the prices are reasonable here based on what I know about this particular process.,positive,2760695_106,5
Your straw. Right they have I like I liked out. I also like your three across so that you can compare some things back and forth.,positive,2760801_46,5
It looks really good the website is very well laid out. Nothing is cluttered.,positive,2770816_70,5
Looks pretty neat I like it so far. All right I'm going to hit next.,positive,2778867_14,5
I think they're really accessible they're like right there in your face kind of makes you want to answer the question because it's bold it's big it's not as easy to scroll past and ignore maybe ask questions on some other website suggestions I have with me again you know I'll put something on the page that lets me know who's running the site.,positive,2767263_49,5
This seems like something that's pretty legit because on Facebook you really don't know what's true you don't know what.,positive,2778867_16,5
You know overall it's very clean and simple and gets right to the point I like I would strongly agree that it's visually appealing it's radical Web site and find a blog post that interesting view blog post.,positive,2779597_25,5
It did look like there was phone numbers and chats that I could do to contact people from the company throughout the Roman process that were presented to me for all these reasons it seems like this seems like a legitimate company and I would have no business.,positive,2760695_100,5
I don't know happier with their opinion that they can actually get somewhere with it.,positive,2778867_84,5
What I need to update my about my subscription. What I can do my card that I'm currently using device management when I got my T.V. So very positive very simple very easy to use very user friendly.,positive,2763062_206,5
It was very fast it was very clean it wasn't like there was only the whole piece of cake was kind to show you like the larger you know any any kind of craziness or look at what we have to offer here it was very cut and dry it was very What is your name what's your address.,positive,2763062_24,5
Yes What I like best here was this specification section and how I can then you all the facts.,positive,2763702_35,5
Kind of kind of like a style or something to associate yourself with things that's that's always good to kind of.,positive,2770907_27,5
OK so when I see the information presented here. It's quick to point you know they're not full of it but it's the same idea doesn't have to be both just like each thing separately placed there so I can easily find that information.,positive,2763702_67,5
So as far as navigation. I think that it's pretty pretty good user friendly.,positive,2767263_17,5
It's something you don't find everywhere else. So it differently. How did the brand or or following.,positive,2770907_64,5
OK. All right. Why do you like the gift basket or a check out screen it's definitely very vibrant and on going on and check out.,positive,2770907_54,5
Read on loads of vailable are really good. So you're basically a free download on your guide to building a positive arm and reputation is definitely something interesting like you said lots of good stuff there.,positive,2770816_31,5
So I love seeing less Certainly I didn't expect it but you guys are.,positive,2763062_188,5
Sure you had the drop down menus on the laugh. Do you had these special buttons in the center when you got to an area and I think those just worked really well I'm not sure you could improve that I did not go look at my cart but I could easily see I had two items and here was the current value when I had finished putting items in the cart.,positive,2760801_72,5
Well you can a tag huh. Let's party. That's pretty cool. I mean we see health care on money.,positive,2778867_75,5
That's part of the inviting makes you want to go through and look more explore as well as the layout you have appear for the different menu options like the way that is laid out in the cool Greenacre roll your cursor across there and see the different options you have pictures are very well mentioned the pictures the pictures are just enough to draw your attention there and to focus on the zine testimonials and because it's all in each one of them has you know you design you more and in life chat.,positive,2770816_34,5
So yeah I really do I really do like that it's very positive very very fun very family ask.,positive,2763062_79,5
It was lively had some gifts or or animated images on it and once you did find the information regarding company it was unique.,positive,2770907_63,5
It was perfect it gave you. Deadlines. Applying to the school. Paying for it the campus life.,positive,2692603_57,5
You know kind of see what's. What's different to do there what's different to eat.,positive,2693070_61,5
And this is what i always went back to you. So without going into extreme detail.,positive,2692603_60,5
Maybe next time i go to chicago. To visit friends pull this off and.,positive,2693070_60,5
Oh. I'm back there. So yeah overall i very understand the eff i don't find it confusing at all.,positive,2693070_15,5
So I said everything that I did see I do I really like the food allergy part I like that you can put notes in there about your child trying to think of something else I would want to see I can't really think of anything because you anything else that you might want to put in you can always put in the Notes section.,positive,2731306_9,5
By magic lemmings. And then after that there was I was able to find the products which I was looking for but equipped our dogs and when I got Gundam I was usually able to see all the product started start a page was very good for make you easy it was easy to understand if I know the information on duty to use.,positive,2708487_79,5
Get around it video that keeps playing the browser designs Yeah. So it's just big drop down menus which are you know it's easy to see it highlights what you're masking over so it's you know I get confused at all.,positive,2734347_58,5
Whatever information. It's a very very easy to find. Sports as well.,positive,2692603_69,5
Most logical step. I take into account is yeah a lot like on these from this page.,positive,2692416_39,5
Told me who speaking. That's awesome. That's really helpful. I think that was very easy actually well not to say very easy because I don't think I had that much trouble with it.,positive,2741838_43,5
It was my savior going in. So i did a wide variety of searching just so google but this is the site i came across.,positive,2692603_59,5
Nice. Is the drop down box. Was good. Some similar products which might as well but that's where.,positive,2692416_38,5
