Segment,polarity,,
I don't know. I don't know what that said about the confirmation email that something i have to look at.,negative,2701940_14,2
More options and. Have both credit card and pay pal available initially that probably i would have liked that better.,negative,2696410_85,2
Just because I have big fingers but I know from selecting I think that could be a touch bigger and.,negative,2759108_169,2
I think they would be a lot more. Terrible. And especially up here where the five guys story.,negative,2691417_138,2
But that's just me and my. Heard the name charlie's and. I mean i was the type of clothing of exactly what it was.,negative,2696575_82,2
You know i could see some a like my parents who maybe aren't the most tech savvy.,negative,2701940_77,2
Some service here. Follow the revolution. Curious it. Was that i know.,negative,2696575_5,2
Word. That's so that's really a little bit i wasn't really expecting that i was expecting that i was going to click on one of the sub sub bullets to actually reach contact.,negative,2691417_70,2
Maybe make this a little bolder a little larger i think. Let's see.,negative,2696410_25,2
Can post a problem sometimes especially if everyone didn't agree. So the decision making.,negative,2690771_209,2
I think the only way to overcome that would be to allow me to tap.,negative,2701940_57,2
It's kind of the. Break between different sections of the page buy for actually find that.,negative,2691417_113,2
So the four photos that you could hear of here. I would say i would like to.,negative,2691417_104,2
Let's have a look. Maybe i should be you. Know the ray tell me what the top of that age is just have that.,negative,2689063_41,2
It's not just underneath them but i'm not i'm not getting. But that's where it's going to go as far as filters like this is also like mcgrath.,negative,2698247_32,2
So I do think that it could be a little larger the text. It's not a huge deal because I did find it and if you're looking at the video.,negative,2741838_47,2
Interesting that it's a black and white photo here. You know i'm assuming there could be some significance to that.,negative,2691417_20,2
So I'm wondering the I hold they don't want any of that extra to use my a painting just think.,negative,2733098_74,2
So i don't really is that they really need those other options. Under more except for.,negative,2698247_119,2
And by the way I just got the text. OK so let's just quick.,negative,2733662_36,2
That can be done. You know. With fat i like that a lot i think the pictures could be tweaked a little bit.,negative,2691417_181,2
I think that would make it just one hundred times better. Would you recommend it to a friend.,negative,2758249_78,2
But what's interesting is that there's a line underneath it. Compared to the quote business where.,negative,2701822_7,2
You know the names of the five guys isn't really mentioned anywhere which is surprising to me.,negative,2691417_140,2
Straight in the head. Rates and options. Rate was quite a long way to get there is kind of a quick turn to getting there but now we've got it that's what i'm looking forward to it right.,negative,2695844_26,2
And here sign in. I wasn't sure what i was expecting and or more i was.,negative,2698247_93,2
And so far I've not seen anything so we might go ahead and use that one but there was a good Catholic right to choose like it's the same one.,negative,2735639_31,2
A lot of times when i see the lines like that. It brings up a sub menu in this didn't bring up a sub when you were just brought up.,negative,2691417_63,2
Other people to kind of look around and I like it when hints to give in to people I love that I like when you know you're in the checkout area.,negative,2746487_95,2
Increase the size of download the app so it's. A little bit bigger.,negative,2691417_188,2
Although I did have a little bit more trouble with this one than I did with the other ones.,negative,2741838_33,2
But it doesn't show it like that on the desk and it's probably like the predator type but.,negative,2692837_19,2
Browser going to the mobile browser. But it has kind of little things you kind of expect on it.,negative,2695844_37,2
I'm seeing if they go to good informative pages. So I think that somebody starting out a business would definitely need to know what is the best way to ship these and then everything else looks like gentlemen.,negative,2757472_64,2
Well and i thought that was pretty simple. I was also surprised that london u.k. came up automatically because i was just kind of pushing a button or so but.,negative,2691417_158,2
Maybe like other forms of filtering might be better for this I know you had a good.,negative,2759108_121,2
You know and it's our job to kind of say ok yes i know we've got about four different issues that we'd like to address showing the meeting but.,negative,2690771_145,2
Global NIH and so I want to look at to see ransom. And I don't want to get inside.,negative,2735639_36,2
I did see it but now it's gone down the page is a page is fully loaded.,negative,2689488_93,2
Some point you have to say ok. We've come up with. Thirty ideas now we have time for four.,negative,2690771_267,2
It is very very difficult for an attendee can fully participate if they are not physically sitting in the room.,negative,2690771_235,2
Because some people in the team i really want one activity you know and.,negative,2690771_206,2
So it seems like it's a little bit different. So my suggestion is just labeling it upload photos or take photos.,negative,2737311_18,2
I don't know what it is I can't put my finger on it. I don't know I just feel like you could clean up the design.,negative,2741838_50,2
So maybe it would be good to have the measurements of the actual dress a little bit clearer.,negative,2746487_48,2
And then another one that might be able to say find your. Find your local five guys so.,negative,2691417_59,2
Besides those minor things where it's like you know the logo is a little bit pixilated So it looks less professional or being able to see the city or being able to read more of a description these are all like things that I didn't like and I would like it was a more if you gave me those options.,negative,2758249_77,2
OK So let's go ahead and go to next. What would make the site better what commitments do you suggest I do think obviously if it was a little bit cleaner.,negative,2758249_71,2
Distracting. And i would prefer something just simpler like a wine or just something simpler.,negative,2691417_114,2
Not entirely sure what that the battle. That's not what you care about what you want to kind of keep me safe and stuff i've chatted we can talk about.,negative,2695844_15,2
And. Sorry. Hundred dollars and then there's my nine cents on a nine and cents feet which is OK.,negative,2733662_32,2
Have a picture of five guys doubt. Maybe that's a mistake on my part that there were actually were five.,negative,2691417_93,2
You know for graphics and it was nice to have all those abilities to filter out for different areas but maybe.,negative,2759108_122,2
Them instead of just sort of not really knowing and then never getting on because you have no idea why you would ever made an account when you can discreetly fill in the day tell us when you could to go.,negative,2746487_98,2
All right so we put that in there and e-mail address if you don't mean and you know I'm trying to go ahead and click that I did I.,negative,2735639_57,2
Yeah. With that picture taking process yeah i think other people might have trouble.,negative,2701940_75,2
Twenty twenty six. Right now I'm going to go ahead. You check out and I'm going to fill out the information here in the text field easy to enter information and it would be nice if they automatically capitalized items activities based part in the fields you weren't using the this in current phone number and me shipping options which is standard which is fine and I'm going to go ahead and close to it here.,negative,2735639_48,2
I'm glad I got her but I was surprised it didn't have a category for things like that just fine three for me pick one for you and your card.,negative,2735639_32,2
Yet having this black background for that it's going to throw me off a little bit just kind of getting acquainted with this right now.,negative,2759108_27,2
Think that transcript. OK let's go back that he. Oh here it is right here right here.,negative,2741838_38,2
It's too far in as a look it should be one of the main.,negative,2692603_103,2
They want. Fifteen dollars. Fact i fell for that once for those a long time ago.,negative,2696410_70,2
I believe it will get started. Student profiles. Ok. Let me show you might maybe find a line and.,negative,2692603_90,2
Just to confirm pay. But yes it looks legitimacy I would I would definitely make sure that it was obvious that there was a tracking number and also asked for make it not optional that the user has a phone number as well I do at this point any thought OK payment is successful what to do you wait ten minutes for the generic labels print your labels easy in that prepare the package the shipment as taking.,negative,2757472_58,2
Yet I would have expected it to find it down here but like I said I wasn't aware that it would be such an important detail.,negative,2734347_45,2
Yes. There are more questions i have. I mean i'm looking for help for a business.,negative,2701822_12,2
So Teflon what I'm going to change is I went put this icon in the label at the top but not THAT ARE other icons in these icons have a more similar functionality and I think that I would change that maybe the process of a difficult view then is the fact that these icons are not legal so was unclear to me what the purpose was of each I hunt actually clicked on it.,negative,2737311_52,2
You know more about us to get to that free shipping. Which is sometimes how they get you back there i explained.,negative,2643900_37,2
Lawyer. I guess the first question in the search box what. What legal jobs.,negative,2701822_13,2
Some kind of an about so that I can learn about you know what's the website for what is the goal.,negative,2767263_50,1
Please wait indicator. OK So that was an exceedingly long time and I think to wait but not.,negative,2767241_63,1
OK well overwhelmed and use so many words not as many pitchers. Door busters.,negative,2764942_77,1
Your new. And. First car. Additional information I'm not really sure what that would entail.,negative,2767241_45,1
Because it's like oh no no you have my credit card number now all the responsibility falls on me to cancel everything which I want and that's a great marketing strategy strategy that's a great way to make extra money for those of us to forget to cancel.,negative,2763062_36,1
If that box was previously here. I didn't notice it first so I would just make it a little more apparent to the end user.,negative,2760695_84,1
Long and tedious. Honestly if they shop for one of the items you purchased early in the task and added to your bag and staff when you get to the checkout page you will need to purchase items are you doing has been talking about your differences better or worse.,negative,2764942_78,1
And it doesn't look like I don't see the information here. So perhaps it was on the previous page.,negative,2760695_92,1
If I wanted to read up on the car and I wasn't quite familiar with this page there's a fairly good chance that I would have never seen that story because it would have seen all the pictures felt the pictures were all that was contained in the bottom part of the page and never got to the article written by that gal and what we remember the most from the site a lot of pictures.,negative,2763702_21,1
You know choosing this this bank over any other other bank. This rate here is clearly just a picture of the pixelation.,negative,2767241_105,1
I think that it is more of a one. For me personally because my email address up on my Facebook is different than the one that I use for everything else like my social media address play my business address email address and I just don't find it that important I mean I'm a big fan of just going in and just typing away my stuff I've never really used the social sign on option for signing up for pretty much anything.,negative,2763062_66,1
I think yes the only thing I have an issue with is it's kind of this layout of the images maybe having more.,negative,2779597_31,1
You know. Well yes I'm sorry. No I'm wrong. This is confusing and clear the connected face but.,negative,2763062_231,1
I'm just wondering if it's safe for to get some sort of you know comparison so I can then put two or three products when my wife finds saw a boy saw it in my judgment by some features of them but unfortunately that's not going to work because of the way they deny how and they just seem to be anywise So a change in the position I price position over.,negative,2767525_11,1
Yeah I think just because loading it seems like the text was hard to read up here and it is seems like a lot of information thrown out here right away.,negative,2779597_40,1
OK market place. OK So this is a movie so it's actually different because I don't know if you noticed but that T.V. series did not have the what the movie which still confuses me why are these here.,negative,2763062_156,1
The amount and the amount of time it takes to finish off it. You know what going the amount of time it takes to finish off its calculations expect a needs to be deduced like it or had time in your time complex piece need to be then used to quite a lot because it's just didn't do.,negative,2769335_50,1
So as far as you're viewing this makes no sense to me I don't know why these are here.,negative,2763062_157,1
I could have because each time this picture changes. I'm not seeing more design.,negative,2770816_43,1
There are some shows that I will watch on Hulu that I don't think my friends need to know that I am watching.,negative,2763062_218,1
Oh I'm sorry I just wanted the free week. But you guys got my card so you can charge me at the end of that week.,negative,2763062_71,1
A promotion code. Let's see here. Having a hard time finding a link right off the bat to enter.,negative,2760695_23,1
Yes the like I stated earlier putting in my credit card information I would you know go into like oh you get a fleet free trial put in all my stuff and then it's like oh what your card number.,negative,2763062_70,1
So what I'm remembering is. Bad thing about it because it's sort of a pain to go through all of them next.,negative,2763702_25,1
Well I mean I'm I just saying that I said it was an issue with the fact that I couldn't compare the various machines to get myself I saw it and I didn't know why you know what might one better than the other know he was OK And oh man.,negative,2767525_38,1
You know. It's OK the way that this is laid out is laid out is a little confusing only because there should be two fields one for the question then one for the answer.,negative,2767241_43,1
Grading and I can count. Well I tried to use try to set it up using Google and that didn't work out I had it said if I had allowed it and I had allowed but then I went to the google to the search engine.,negative,2778867_28,1
What that does. Without doubt it was for a while I'm not naturally keen on this it's so so out of the budget and the more I don't know especially Oh for the strange night around.,negative,2767525_12,1
Call which is the problem. I just read the article because it was so long.,negative,2763702_66,1
Do. Let's start with season one episode. That mean camp. The mutant turtles won wasn't playing was not expecting that to start playing.,negative,2763062_153,1
It talks about show me different. Zines that there's only really one design not to impress little looking for something to show me some different design that was one of the things I tried to find but I really saw one design.,negative,2770816_45,1
That's the one big thing that prevented me from far from the cell a system like difficulties because you can't.,negative,2767525_39,1
So if I spend has been fifteen dollars but then I'm spending ten dollars just to get it shipped so that's twenty five dollars so it's like you're forcing me to get another idea to get the free shipping.,negative,2764942_85,1
Being intelligent. So it's not the easiest form to sell out if you know the talking in the background doing those two things at once you've made for.,negative,2767241_51,1
In terms of the graphical layout but other things are not quite what I would expect Lee I can't really figure out how I would add my own answer to the question any final thoughts please provide additional comments questions or suggestions you have before you stop recording.,negative,2767263_41,1
And there are some probably fell to its way to look so I know I say so functionality and choosing what mods on days like quite difficult.,negative,2767525_18,1
The only thing I really disliked about this was the requirement that I had to have the name of an O.B. at this particular time I think it's possible that I might not have that information now that and it looks like it won't be able to go through and complete the process.,negative,2760695_103,1
I mean. So this process right now snatching up all that data parsing it doing all that good stuff.,negative,2767241_61,1
You know I couldn't look at so if I saw it with the stakes and prices and things like that so you know I wouldn't need to know whether one offered a particular benefit.,negative,2767525_49,1
At the moment same budget. I'm going to say one hundred thousand and six hundred thousand but it would be that what is important but we had budget not understanding that entirely.,negative,2772615_41,1
I'm sorry I was expecting to actually go up here to the upper right.,negative,2763062_11,1
To business and twenty three. That's pretty easy and it just seems to take so long and then just wouldn't upload as quickly like it makes me not even want to use the site.,negative,2764942_82,1
On the comments tab again. Go ahead. You know many companies are Web sites that are similar to this one so explain how this one compares.,negative,2767263_31,1
There's a couple hookups in it. I think the two questions and then putting in five more they actually seem like a different layout as well so I'm given that not very good score as far as the usability.,negative,2767241_90,1
But at the same time you're you're opening opening up a whole new whole other area for people to feel uncomfortable about giving up their card number on something that they were just hoping to get for free it's like well three the why do I have to why do I have to give you my my card.,negative,2763062_37,1
OK. So OK. So maybe a lot slower. Now why is a console on.,negative,2764942_80,1
With the format of a question mark and an answer that was a strange way to do it I've never seen it done that way before and I would not feel comfortable doing business with a bank that went that route.,negative,2767241_92,1
Nice to have I feel like it's common sense that they use big words and here's what I'm currently watching this doesn't even register on the scale.,negative,2763062_167,1
It seems like one of those. Speaks. Self type websites. Some very very low on the attractive scale but it's also not annoying.,negative,2767241_96,1
I am a hater of your Social Media Edition. They just seem youth.,negative,2763062_220,1
I would probably draw a distinction between this this for me seems a little odd here the header and the menu of the site.,negative,2779597_65,1
It and. So and the question is Is there any information on this page I think is missing definitely something about the company doesn't have to be right on the front page and it could be towards the bottom of the front page but there should be some association with this company is where they're located.,negative,2770907_36,1
I don't think that's the Web I think that's just my brain is just immediately think everything should be on the right.,negative,2763062_15,1
So. So now we're into more security questions. He seems. Completely over the top.,negative,2767241_55,1
The rest of it. Could have been a little more streamlined just you know following kind of the standard sign up.,negative,2767241_71,1
I mean I'm just saying I don't really care for this. I'm sorry Hulu.,negative,2763062_219,1
And so this doesn't pertain to me as a watcher this just seems useless on my page.,negative,2763062_134,1
That's right. So the initial sign up process. Compared to others that was disjointed and much worse.,negative,2767241_69,1
The only Like I said there was a continuity issue with the questions I was asked to put in the first time.,negative,2767241_91,1
They're not seeing anything that really gives me an idea of what type of design.,negative,2770816_42,1
That sounds like a lot of money. Wow OK. Not happy with the amount of shipping that's costing for two small shirts.,negative,2764942_50,1
My my initial. Opinions of the site are. Exactly above and beyond anything that I would want to apply for if I personally.,negative,2767241_12,1
Look at the page and I'm not seeing an answer to that question. I'm going to review this page one more time to see if the answer is here.,negative,2760695_91,1
Possibly streamlined a lot more. I would definitely cut out those two security questions before having to put in five more that seemed absolutely redundant.,negative,2767241_86,1
You know what. No I think I'm just going to pass so honestly it's all drawn back to putting in my payment information.,negative,2763062_72,1
You know. The user flow. I notice there was zero option for auto fill.,negative,2767241_108,1
I think about it not too bad the information comes. Itself is it's hard to find because at the bottom at the bottom of the page and the titles of the links that you need to navigate to these pages are great on a white background so the contrast is not that great kind of hard to find or maybe not hard to find her notice.,negative,2770907_67,1
OK. Going to go down here on five call. Oh I guess I have to finish doing my.,negative,2778867_32,1
If I can afford to type in my own name I feel like that's really really the that's just me I don't find it important all because I personally don't use it and the one time that I did it just just seemed like a waste of time.,negative,2763062_68,1
If I spoke Spanish and I was attending the event. You could hear my page with this but this does not pertain to me I would remove that same thing with I thought here just to get rich.,negative,2763062_135,1
You know I can't believe that you would put this. I mean I I'm sorry for the categorizing But this is something that I felt that people might find offensive that they might see that and just be like hey I would like to block this.,negative,2763062_137,1
When it's. You. You know allow me to decide when to snap the picture versus the app doing it automatically once it senses that the card is within the frame.,negative,2701940_58,1
Appear to be able to search. You know for some reason you've forgotten or didn't bother you does the first thing you put the search to be able to search in a city state little search bar down here.,negative,2698247_48,1
I see this looks like it's not exactly what I was expecting though in the ME that's in the home since I was on the other section that actually looks like this is about template passing you can find so again my suggestion is wait for this icon so more clear what the main purpose.,negative,2737311_19,1
My power wires. That's just my password is not so here so I'm not really sure why so me try it again.,negative,2741896_5,1
It's like. What would inspire me to swap what bank you know to keep the bank.,negative,2695844_33,1
I'm trying to go to it. Let's go back. There's the middle and it's completely locked up so let's see what we can do here and.,negative,2756980_34,1
Now I see that it wants me to do things that an actual to Torah let me see there's a tutorial but others it's a journal but never go.,negative,2756980_26,1
I just think that personally I would be more likely to sign up and more likely to take the test if the site was more appealing.,negative,2741838_52,1
But I do think for me the major one to make this look like a site that is less like an ad make sure that all of your logos are crisp and clean so that it kind of all goes together right now it's a little bit clunky because like the menu the request for info find your franchise start searching now they're all like different looking fonts.,negative,2758249_87,1
Maybe people don't like the music the music could be knowing that you have an on and OS which but that could be a case there's a lot of things people may not like the cartoon aspect of it.,negative,2756980_56,1
Is so small and I know that I'm proportionately different from her it would make me slightly uncomfortable just a bottom line.,negative,2746487_72,1
That's the best way to contact anyone so I don't think that should be optional The other thing is I very much like that last page especially if the links.,negative,2757472_63,1
The same kind of colors so that it's easier to kind of navigate and look at and right now looking at this front page it just looks like a pop up ad and if I didn't click on this website specifically I would just assume it was a pop up ad.,negative,2758249_89,1
Or a mobile app and makes it very difficult. But again to answer your question what I trusted to give me a refund Probably not because I don't know I don't know exactly what I'm dealing with I don't go for the soft question here was anything difficult and confusing what would you change I was confusing because it wasn't working and my phone kind of locked up but once I restarted things were better.,negative,2756980_61,1
